B1: Q1 | C1: Q2 | D1: Q3 | E1: Q4 | G1: H1 | H1: H2 | J1: Midterm | K1: Report | L1: Final | N1: 平時 | O1: 學期成績
A2: 8720058 | B2: 14 | C2: 20 | D2: 18 | E2: 14 | F2: =(SUM(B2:E2)-SMALL(B2:E2,1))/3 -> 17.333333333333332 | G2: 17 | H2: 20 | I2: =(G2+H2)/4 -> 9.25 | J2: 85 | K2: 15 | L2: 84 | N2: 9 | O2: 93.783333333333331
A3: 8720080 | B3: 12 | C3: 18 | D3: 14 | E3: 6 | F3: =(SUM(B3:E3)-SMALL(B3:E3,1))/3 -> 14.666666666666666 | H3: 20 | I3: =(G3+H3)/4 -> 5 | J3: 68 | K3: 11 | L3: 80 | M3: 1 | N3: 9 | O3: 78.566666666666663
A4: 8720082 | B4: 12 | C4: 9 | D4: 15 | E4: 16 | F4: =(SUM(B4:E4)-SMALL(B4:E4,1))/3 -> 14.333333333333334 | G4: 15 | H4: 20 | I4: =(G4+H4)/4 -> 8.75 | J4: 62 | K4: 15 | L4: 78 | N4: 9 | O4: 81.583333333333343
A5: 8720084 | B5: 10 | C5: 18 | D5: 17 | E5: 13 | F5: =(SUM(B5:E5)-SMALL(B5:E5,1))/3 -> 16 | H5: 20 | I5: =(G5+H5)/4 -> 5 | J5: 71 | K5: 14 | L5: 71 | M5: 1 | N5: 9 | O5: 79.6
A6: 8720086 | B6: 11 | C6: 19 | D6: 11 | E6: 10 | F6: =(SUM(B6:E6)-SMALL(B6:E6,1))/3 -> 13.666666666666666 | G6: 14 | H6: 18 | I6: =(G6+H6)/4 -> 8 | J6: 68 | K6: 17 | L6: 84 | N6: 9 | O6: 84.766666666666666
A7: 8720090 | B7: 8 | C7: 19 | D7: 14 | E7: 8 | F7: =(SUM(B7:E7)-SMALL(B7:E7,1))/3 -> 13.666666666666666 | H7: 18 | I7: =(G7+H7)/4 -> 4.5 | J7: 60 | K7: 13 | L7: 84 | M7: 1 | N7: 9 | O7: 76.86666666666666
A8: 8720810 | B8: 15 | C8: 19 | D8: 17 | E8: 9 | F8: =(SUM(B8:E8)-SMALL(B8:E8,1))/3 -> 17 | G8: 10 | H8: 18 | I8: =(G8+H8)/4 -> 7 | J8: 80 | K8: 16 | L8: 78 | N8: 9 | O8: 88.4
A9: 8720832 | B9: 15 | C9: 18 | D9: 11 | E9: 15 | F9: =(SUM(B9:E9)-SMALL(B9:E9,1))/3 -> 16 | G9: 16 | H9: 19 | I9: =(G9+H9)/4 -> 8.75 | J9: 61 | K9: 18 | L9: 66 | N9: 9 | O9: 80.85
A10: 8806104 | B10: 16 | C10: 15 | D10: 17 | E10: 7 | F10: =(SUM(B10:E10)-SMALL(B10:E10,1))/3 -> 16 | G10: 17 | H10: 18 | I10: =(G10+H10)/4 -> 8.75 | J10: 60 | K10: 16 | L10: 61 | M10: 1 | N10: 9 | O10: 78.05
A11: 8820047 | B11: 15 | C11: 17 | D11: 12 | E11: 14 | F11: =(SUM(B11:E11)-SMALL(B11:E11,1))/3 -> 15.333333333333334 | G11: 16 | H11: 18 | I11: =(G11+H11)/4 -> 8.5 | J11: 65 | K11: 13 | L11: 74 | N11: 9 | O11: 81.033333333333331
A12: 8820063 | B12: 14 | C12: 18 | D12: 16 | E12: 9 | F12: =(SUM(B12:E12)-SMALL(B12:E12,1))/3 -> 16 | G12: 16 | H12: 18 | I12: =(G12+H12)/4 -> 8.5 | J12: 58 | K12: 15 | L12: 72 | M12: 1 | N12: 9 | O12: 80
A13: 8820089 | B13: 14 | C13: 15 | D13: 9 | E13: 11 | F13: =(SUM(B13:E13)-SMALL(B13:E13,1))/3 -> 13.333333333333334 | G13: 11 | H13: 14 | I13: =(G13+H13)/4 -> 6.25 | J13: 39 | K13: 15 | L13: 67 | M13: 2 | N13: 6 | O13: 64.883333333333326
A14: 8820093 | B14: 8 | C14: 18 | D14: 10 | E14: 9 | F14: =(SUM(B14:E14)-SMALL(B14:E14,1))/3 -> 12.333333333333334 | G14: 14 | H14: 18 | I14: =(G14+H14)/4 -> 8 | J14: 62 | K14: 13 | L14: 37 | M14: 2 | N14: 6 | O14: 62.533333333333339
A15: 8820806 | B15: 13 | C15: 14 | D15: 13 | E15: 5 | F15: =(SUM(B15:E15)-SMALL(B15:E15,1))/3 -> 13.333333333333334 | G15: 18 | H15: 19 | I15: =(G15+H15)/4 -> 9.25 | J15: 48 | K15: 15 | L15: 52 | N15: 9 | O15: 69.083333333333343
A16: 8820811 | B16: 17 | C16: 19 | D16: 19 | E16: 13 | F16: =(SUM(B16:E16)-SMALL(B16:E16,1))/3 -> 18.333333333333332 | G16: 16 | H16: 20 | I16: =(G16+H16)/4 -> 9 | J16: 83 | K16: 14 | L16: 84 | N16: 9 | O16: 93.433333333333337
A17: 8820814 | B17: 16 | C17: 14 | D17: 17 | E17: 10 | F17: =(SUM(B17:E17)-SMALL(B17:E17,1))/3 -> 15.666666666666666 | G17: 13 | H17: 15 | I17: =(G17+H17)/4 -> 7 | J17: 47 | K17: 16 | L17: 60 | M17: 1 | N17: 9 | O17: 71.766666666666666
A18: 8820816 | B18: 15 | C18: 13 | D18: 14 | E18: 5 | F18: =(SUM(B18:E18)-SMALL(B18:E18,1))/3 -> 14 | G18: 17 | H18: 14 | I18: =(G18+H18)/4 -> 7.75 | J18: 69 | K18: 14 | L18: 70 | M18: 1 | N18: 9 | O18: 79.45
A19: 8820819 | B19: 15 | C19: 17 | D19: 17 | E19: 12 | F19: =(SUM(B19:E19)-SMALL(B19:E19,1))/3 -> 16.333333333333332 | G19: 15 | H19: 20 | I19: =(G19+H19)/4 -> 8.75 | J19: 60 | K19: 16 | L19: 50 | N19: 9 | O19: 75.083333333333329
A20: 8920801 | B20: 16 | C20: 18 | D20: 19 | E20: 10 | F20: =(SUM(B20:E20)-SMALL(B20:E20,1))/3 -> 17.666666666666668 | G20: 13 | H20: 18 | I20: =(G20+H20)/4 -> 7.75 | J20: 83 | K20: 15 | L20: 90 | M20: 1 | N20: 9 | O20: 93.816666666666663
A21: 9020001A | B21: 11 | C21: 10 | D21: 7 | E21: 1 | F21: =(SUM(B21:E21)-SMALL(B21:E21,1))/3 -> 9.3333333333333339 | G21: 9 | H21: 17 | I21: =(G21+H21)/4 -> 6.5 | J21: 28 | L21: 35 | M21: 4 | N21: 0 | O21: 34.733333333333334
A22: 9020003A | B22: 10 | C22: 16 | D22: 9 | E22: 6 | F22: =(SUM(B22:E22)-SMALL(B22:E22,1))/3 -> 11.666666666666666 | G22: 14 | H22: 16 | I22: =(G22+H22)/4 -> 7.5 | J22: 39 | K22: 10 | L22: 22 | M22: 1 | N22: 9 | O22: 51.466666666666661
A23: 9020009A | B23: 10 | C23: 12 | D23: 8 | E23: 15 | F23: =(SUM(B23:E23)-SMALL(B23:E23,1))/3 -> 12.333333333333334 | G23: 9 | H23: 15 | I23: =(G23+H23)/4 -> 6 | J23: 40 | K23: 12 | L23: 56 | N23: 9 | O23: 62.13333333333334
A24: 9020013A | B24: 15 | C24: 15 | D24: 11 | F24: =SUM(B24:E24)/3 -> 13.666666666666666 | G24: 15 | H24: 18 | I24: =(G24+H24)/4 -> 8.25 | J24: 52 | K24: 15 | L24: 56 | M24: 1 | N24: 9 | O24: 70.816666666666663
A25: 9020015A | B25: 5 | C25: 14 | D25: 7 | E25: 6 | F25: =(SUM(B25:E25)-SMALL(B25:E25,1))/3 -> 9 | G25: 10 | H25: 15 | I25: =(G25+H25)/4 -> 6.25 | J25: 36 | K25: 17 | L25: 29 | M25: 1 | N25: 9 | O25: 52.25
A26: 9020017A | B26: 9 | C26: 13 | D26: 7 | E26: 7 | F26: =(SUM(B26:E26)-SMALL(B26:E26,1))/3 -> 9.6666666666666661 | G26: 13 | H26: 17 | I26: =(G26+H26)/4 -> 7.5 | J26: 50 | K26: 16 | L26: 48 | N26: 9 | O26: 63.566666666666663
A27: 9020021A | B27: 14 | C27: 18 | D27: 14 | E27: 15 | F27: =(SUM(B27:E27)-SMALL(B27:E27,1))/3 -> 15.666666666666666 | G27: 13 | H27: 20 | I27: =(G27+H27)/4 -> 8.25 | J27: 58 | K27: 13 | L27: 70 | N27: 9 | O27: 77.816666666666663
A28: 9020023A | B28: 10 | C28: 19 | D28: 14 | E28: 8 | F28: =(SUM(B28:E28)-SMALL(B28:E28,1))/3 -> 14.333333333333334 | G28: 12 | H28: 20 | I28: =(G28+H28)/4 -> 8 | J28: 46 | K28: 16 | L28: 58 | N28: 9 | O28: 70.533333333333331
A29: 9020025A | B29: 11 | C29: 11 | D29: 11 | E29: 13 | F29: =(SUM(B29:E29)-SMALL(B29:E29,1))/3 -> 11.666666666666666 | G29: 12 | H29: 17 | I29: =(G29+H29)/4 -> 7.25 | J29: 50 | K29: 6 | L29: 44 | N29: 9 | O29: 60
A30: 9020029A | B30: 16 | C30: 9 | D30: 7 | E30: 6 | F30: =(SUM(B30:E30)-SMALL(B30:E30,1))/3 -> 10.666666666666666 | G30: 12 | H30: 16 | I30: =(G30+H30)/4 -> 7 | J30: 28 | K30: 2 | L30: 12 | N30: 9 | O30: 39.666666666666664
A31: 9020031A | B31: 11 | C31: 13 | D31: 4 | F31: =SUM(B31:E31)/3 -> 9.3333333333333339 | G31: 11 | H31: 17 | I31: =(G31+H31)/4 -> 7 | J31: 33 | K31: 14 | L31: 28 | M31: 1 | N31: 9 | O31: 50.633333333333333
A32: 9020033A | B32: 8 | C32: 12 | D32: 10 | E32: 10 | F32: =(SUM(B32:E32)-SMALL(B32:E32,1))/3 -> 10.666666666666666 | G32: 10 | H32: 17 | I32: =(G32+H32)/4 -> 6.75 | J32: 47 | K32: 11 | L32: 37 | N32: 9 | O32: 60
A33: 9020035A | B33: 14 | C33: 17 | D33: 10 | E33: 7 | F33: =(SUM(B33:E33)-SMALL(B33:E33,1))/3 -> 13.666666666666666 | G33: 12 | H33: 18 | I33: =(G33+H33)/4 -> 7.5 | J33: 34 | K33: 8 | L33: 28 | M33: 1 | N33: 9 | O33: 52.766666666666659
A34: 9020037A | B34: 5 | C34: 17 | D34: 6 | E34: 6 | F34: =(SUM(B34:E34)-SMALL(B34:E34,1))/3 -> 9.6666666666666661 | G34: 14 | H34: 18 | I34: =(G34+H34)/4 -> 8 | J34: 47 | K34: 12 | L34: 43 | N34: 9 | O34: 59.666666666666664
A35: 9020039A | B35: 5 | C35: 13 | D35: 8 | E35: 6 | F35: =(SUM(B35:E35)-SMALL(B35:E35,1))/3 -> 9 | G35: 8 | H35: 20 | I35: =(G35+H35)/4 -> 7 | J35: 22 | L35: 38 | M35: 2 | N35: 6 | O35: 40
A36: 9020043A | B36: 8 | C36: 14 | D36: 8 | E36: 8 | F36: =(SUM(B36:E36)-SMALL(B36:E36,1))/3 -> 10 | G36: 11 | H36: 17 | I36: =(G36+H36)/4 -> 7 | J36: 34 | K36: 10 | L36: 20 | N36: 9 | O36: 47.2
A37: 9020047A | B37: 14 | C37: 14 | D37: 14 | E37: 8 | F37: =(SUM(B37:E37)-SMALL(B37:E37,1))/3 -> 14 | G37: 10 | H37: 20 | I37: =(G37+H37)/4 -> 7.5 | J37: 39 | K37: 11 | L37: 50 | N37: 9 | O37: 62.7
A38: 9020049A | B38: 8 | D38: 9 | E38: 8 | F38: =SUM(B38:E38)/3 -> 8.3333333333333339 | H38: 10 | I38: =(G38+H38)/4 -> 2.5 | J38: 23 | L38: 35 | M38: 6 | N38: 0 | O38: 28.233333333333334
A39: 9020051A | B39: 14 | C39: 11 | D39: 7 | E39: 13 | F39: =(SUM(B39:E39)-SMALL(B39:E39,1))/3 -> 12.666666666666666 | G39: 15 | H39: 9 | I39: =(G39+H39)/4 -> 6 | J39: 55 | K39: 12 | L39: 46 | N39: 9 | O39: 63.966666666666661
A40: 9020053A | B40: 7 | C40: 13 | D40: 12 | E40: 12 | F40: =(SUM(B40:E40)-SMALL(B40:E40,1))/3 -> 12.333333333333334 | G40: 11 | H40: 20 | I40: =(G40+H40)/4 -> 7.75 | J40: 42 | K40: 11 | L40: 43 | N40: 9 | O40: 60.083333333333336
A41: 9020055A | B41: 9 | C41: 16 | D41: 13 | E41: 11 | F41: =(SUM(B41:E41)-SMALL(B41:E41,1))/3 -> 13.333333333333334 | G41: 9 | H41: 20 | I41: =(G41+H41)/4 -> 7.25 | J41: 60 | K41: 14 | L41: 54 | N41: 9 | O41: 70.783333333333331
A42: 9020059A | B42: 12 | C42: 11 | D42: 18 | E42: 17 | F42: =(SUM(B42:E42)-SMALL(B42:E42,1))/3 -> 15.666666666666666 | G42: 15 | H42: 20 | I42: =(G42+H42)/4 -> 8.75 | J42: 32 | K42: 14 | L42: 58 | N42: 9 | O42: 67.416666666666657
A43: 9020061A | B43: 11 | D43: 6 | E43: 18 | F43: =SUM(B43:E43)/3 -> 11.666666666666666 | G43: 16 | I43: =(G43+H43)/4 -> 4 | J43: 36 | K43: 14 | L43: 71 | M43: 2 | N43: 6 | O43: 60.766666666666666
A44: 9020063A | B44: 13 | C44: 8 | D44: 13 | E44: 8 | F44: =(SUM(B44:E44)-SMALL(B44:E44,1))/3 -> 11.333333333333334 | G44: 16 | H44: 19 | I44: =(G44+H44)/4 -> 8.75 | J44: 45 | K44: 11 | L44: 26 | N44: 9 | O44: 55.883333333333333
A45: 9020065A | C45: 12 | D45: 8 | E45: 8 | F45: =SUM(B45:E45)/3 -> 9.3333333333333339 | H45: 17 | I45: =(G45+H45)/4 -> 4.25 | J45: 43 | K45: 4 | L45: 38 | M45: 2 | N45: 6 | O45: 45.883333333333333
A46: 9020067A | B46: 7 | C46: 17 | D46: 13 | E46: 10 | F46: =(SUM(B46:E46)-SMALL(B46:E46,1))/3 -> 13.333333333333334 | G46: 10 | H46: 18 | I46: =(G46+H46)/4 -> 7 | J46: 47 | K46: 10 | L46: 33 | N46: 9 | O46: 60
A47: 9020069A | B47: 14 | C47: 13 | D47: 14 | E47: 15 | F47: =(SUM(B47:E47)-SMALL(B47:E47,1))/3 -> 14.333333333333334 | G47: 16 | H47: 20 | I47: =(G47+H47)/4 -> 9 | J47: 82 | L47: 61 | M47: 2 | N47: 6 | O47: 72.233333333333334
A48: 9020071A | B48: 11 | C48: 15 | D48: 8 | E48: 9 | F48: =(SUM(B48:E48)-SMALL(B48:E48,1))/3 -> 11.666666666666666 | G48: 13 | H48: 16 | I48: =(G48+H48)/4 -> 7.25 | J48: 42 | K48: 12 | L48: 25 | N48: 9 | O48: 54.016666666666666
A49: 9020073A | B49: 14 | C49: 17 | D49: 18 | E49: 12 | F49: =(SUM(B49:E49)-SMALL(B49:E49,1))/3 -> 16.333333333333332 | G49: 12 | H49: 19 | I49: =(G49+H49)/4 -> 7.75 | J49: 64 | K49: 14 | L49: 52 | N49: 9 | O49: 74.883333333333326
A50: 9020075A | B50: 9 | C50: 8 | D50: 5 | E50: 5 | F50: =(SUM(B50:E50)-SMALL(B50:E50,1))/3 -> 7.333333333333333 | G50: 11 | H50: 20 | I50: =(G50+H50)/4 -> 7.75 | J50: 45 | K50: 16 | L50: 34 | M50: 2 | N50: 6 | O50: 52.783333333333331
A51: 9020077A | B51: 10 | C51: 16 | D51: 6 | E51: 11 | F51: =(SUM(B51:E51)-SMALL(B51:E51,1))/3 -> 12.333333333333334 | G51: 9 | H51: 20 | I51: =(G51+H51)/4 -> 7.25 | J51: 41 | L51: 27 | M51: 2 | N51: 6 | O51: 45.983333333333334
A52: 9020081A | B52: 15 | C52: 16 | D52: 11 | E52: 6 | F52: =(SUM(B52:E52)-SMALL(B52:E52,1))/3 -> 14 | G52: 13 | H52: 17 | I52: =(G52+H52)/4 -> 7.5 | J52: 42 | K52: 14 | L52: 49 | N52: 9 | O52: 64.8
A53: 9020083A | B53: 10 | C53: 11 | E53: 7 | F53: =SUM(B53:E53)/3 -> 9.3333333333333339 | G53: 8 | H53: 18 | I53: =(G53+H53)/4 -> 6.5 | J53: 35 | L53: 20 | M53: 5 | N53: 0 | O53: 32.333333333333336
A54: 9020087A | B54: 8 | C54: 16 | D54: 12 | E54: 6 | F54: =(SUM(B54:E54)-SMALL(B54:E54,1))/3 -> 12 | G54: 11 | H54: 18 | I54: =(G54+H54)/4 -> 7.25 | J54: 55 | K54: 12 | L54: 69 | M54: 1 | N54: 9 | O54: 71.45
A55: 9020089A | B55: 16 | C55: 18 | D55: 11 | E55: 16 | F55: =(SUM(B55:E55)-SMALL(B55:E55,1))/3 -> 16.666666666666668 | G55: 16 | H55: 20 | I55: =(G55+H55)/4 -> 9 | J55: 78 | L55: 78 | M55: 2 | N55: 6 | O55: 78.466666666666669
A56: 9020091A | B56: 5 | C56: 12 | D56: 14 | E56: 8 | F56: =(SUM(B56:E56)-SMALL(B56:E56,1))/3 -> 11.333333333333334 | G56: 11 | H56: 19 | I56: =(G56+H56)/4 -> 7.5 | J56: 39 | K56: 12 | L56: 45 | M56: 1 | N56: 9 | O56: 60
A57: 9020093A | B57: 11 | C57: 18 | D57: 15 | E57: 11 | F57: =(SUM(B57:E57)-SMALL(B57:E57,1))/3 -> 14.666666666666666 | G57: 13 | H57: 18 | I57: =(G57+H57)/4 -> 7.75 | J57: 44 | K57: 10 | L57: 68 | N57: 9 | O57: 70.016666666666652
A58: 9020095A | B58: 11 | C58: 16 | D58: 13 | E58: 17 | F58: =(SUM(B58:E58)-SMALL(B58:E58,1))/3 -> 15.333333333333334 | G58: 12 | H58: 18 | I58: =(G58+H58)/4 -> 7.5 | J58: 66 | K58: 16 | L58: 83 | M58: 1 | N58: 9 | O58: 84.533333333333331
A59: 9020099A | B59: 17 | C59: 17 | D59: 7 | E59: 15 | F59: =(SUM(B59:E59)-SMALL(B59:E59,1))/3 -> 16.333333333333332 | G59: 9 | H59: 20 | I59: =(G59+H59)/4 -> 7.25 | J59: 63 | K59: 8 | L59: 60 | N59: 9 | O59: 73.483333333333334
A60: 9020101A | B60: 13 | C60: 16 | D60: 8 | E60: 7 | F60: =(SUM(B60:E60)-SMALL(B60:E60,1))/3 -> 12.333333333333334 | G60: 12 | H60: 18 | I60: =(G60+H60)/4 -> 7.5 | J60: 52 | L60: 41 | M60: 2 | N60: 6 | O60: 53.733333333333334
A61: 9020103A | B61: 12 | C61: 11 | D61: 5 | E61: 8 | F61: =(SUM(B61:E61)-SMALL(B61:E61,1))/3 -> 10.333333333333334 | G61: 10 | H61: 19 | I61: =(G61+H61)/4 -> 7.25 | J61: 32 | K61: 2 | L61: 27 | N61: 9 | O61: 45.283333333333339
A62: 9020105A | B62: 14 | C62: 15 | D62: 11 | E62: 9 | F62: =(SUM(B62:E62)-SMALL(B62:E62,1))/3 -> 13.333333333333334 | G62: 14 | H62: 19 | I62: =(G62+H62)/4 -> 8.25 | J62: 52 | K62: 7 | L62: 42 | N62: 9 | O62: 62.283333333333339
A63: 9020107A | B63: 11 | C63: 19 | D63: 13 | E63: 9 | F63: =(SUM(B63:E63)-SMALL(B63:E63,1))/3 -> 14.333333333333334 | G63: 13 | H63: 18 | I63: =(G63+H63)/4 -> 7.75 | J63: 62 | K63: 12 | L63: 60 | N63: 9 | O63: 73.683333333333337
A64: 9020109A | B64: 10 | C64: 17 | D64: 14 | E64: 11 | F64: =(SUM(B64:E64)-SMALL(B64:E64,1))/3 -> 14 | G64: 12 | H64: 19 | I64: =(G64+H64)/4 -> 7.75 | J64: 33 | K64: 14 | L64: 40 | M64: 3 | N64: 3 | O64: 53.65
A65: 9020111A | B65: 10 | C65: 14 | D65: 15 | E65: 13 | F65: =(SUM(B65:E65)-SMALL(B65:E65,1))/3 -> 14 | G65: 10 | H65: 15 | I65: =(G65+H65)/4 -> 6.25 | J65: 20 | K65: 14 | L65: 43 | M65: 1 | N65: 9 | O65: 55.15
A66: 9020113A | B66: 9 | C66: 14 | D66: 8 | E66: 11 | F66: =(SUM(B66:E66)-SMALL(B66:E66,1))/3 -> 11.333333333333334 | G66: 9 | H66: 13 | I66: =(G66+H66)/4 -> 5.5 | J66: 33 | K66: 14 | L66: 52 | M66: 1 | N66: 9 | O66: 60
A67: 9020115A | B67: 12 | C67: 11 | D67: 4 | E67: 5 | F67: =(SUM(B67:E67)-SMALL(B67:E67,1))/3 -> 9.3333333333333339 | G67: 10 | H67: 7 | I67: =(G67+H67)/4 -> 4.25 | J67: 30 | L67: 10 | M67: 5 | N67: 0 | O67: 25.583333333333336
A68: 9020117A | B68: 10 | C68: 10 | D68: 9 | E68: 4 | F68: =(SUM(B68:E68)-SMALL(B68:E68,1))/3 -> 9.6666666666666661 | G68: 16 | H68: 18 | I68: =(G68+H68)/4 -> 8.5 | J68: 32 | L68: 10 | M68: 3 | N68: 3 | O68: 33.766666666666666
A69: 9020119A | B69: 14 | C69: 14 | D69: 5 | E69: 7 | F69: =(SUM(B69:E69)-SMALL(B69:E69,1))/3 -> 11.666666666666666 | G69: 14 | H69: 18 | I69: =(G69+H69)/4 -> 8 | J69: 45 | L69: 36 | M69: 2 | N69: 6 | O69: 49.966666666666661
A70: 9020121A | B70: 11 | C70: 15 | D70: 16 | E70: 6 | F70: =(SUM(B70:E70)-SMALL(B70:E70,1))/3 -> 14 | G70: 12 | H70: 17 | I70: =(G70+H70)/4 -> 7.25 | J70: 38 | K70: 10 | L70: 25 | N70: 9 | O70: 54.15
A71: 9020123A | B71: 9 | C71: 12 | D71: 14 | E71: 14 | F71: =(SUM(B71:E71)-SMALL(B71:E71,1))/3 -> 13.333333333333334 | G71: 14 | H71: 18 | I71: =(G71+H71)/4 -> 8 | J71: 61 | K71: 16 | L71: 58 | N71: 9 | O71: 74.033333333333331
A72: 9020125A | B72: 10 | C72: 16 | D72: 16 | E72: 10 | F72: =(SUM(B72:E72)-SMALL(B72:E72,1))/3 -> 14 | G72: 7 | H72: 18 | I72: =(G72+H72)/4 -> 6.25 | J72: 37 | K72: 11 | L72: 44 | N72: 9 | O72: 60
A73: 9020127A | B73: 10 | C73: 17 | D73: 11 | E73: 10 | F73: =(SUM(B73:E73)-SMALL(B73:E73,1))/3 -> 12.666666666666666 | G73: 13 | H73: 18 | I73: =(G73+H73)/4 -> 7.75 | J73: 71 | K73: 18 | L73: 72 | N73: 9 | O73: 81.316666666666663
A74: 9020129A | B74: 10 | C74: 13 | D74: 13 | E74: 8 | F74: =(SUM(B74:E74)-SMALL(B74:E74,1))/3 -> 12 | G74: 14 | H74: 17 | I74: =(G74+H74)/4 -> 7.75 | J74: 45 | K74: 13 | L74: 30 | M74: 1 | N74: 9 | O74: 60
A75: 9020131A | B75: 10 | C75: 13 | D75: 5 | E75: 6 | F75: =(SUM(B75:E75)-SMALL(B75:E75,1))/3 -> 9.6666666666666661 | G75: 8 | H75: 17 | I75: =(G75+H75)/4 -> 6.25 | J75: 37 | K75: 5 | L75: 46 | N75: 9 | O75: 52.316666666666663
A76: 9020133A | C76: 13 | D76: 18 | E76: 8 | F76: =SUM(B76:E76)/3 -> 13 | H76: 17 | I76: =(G76+H76)/4 -> 4.25 | J76: 40 | K76: 11 | L76: 65 | M76: 2 | N76: 6 | O76: 60.25
A77: 9020135A | B77: 11 | C77: 14 | D77: 8 | E77: 6 | F77: =(SUM(B77:E77)-SMALL(B77:E77,1))/3 -> 11 | G77: 12 | H77: 20 | I77: =(G77+H77)/4 -> 8 | J77: 28 | K77: 4 | L77: 18 | M77: 1 | N77: 9 | O77: 43.8
A78: 9020137A | B78: 9 | C78: 5 | D78: 4 | E78: 8 | F78: =(SUM(B78:E78)-SMALL(B78:E78,1))/3 -> 7.333333333333333 | G78: 10 | H78: 20 | I78: =(G78+H78)/4 -> 7.5 | J78: 32 | K78: 6 | L78: 21 | N78: 9 | O78: 42.733333333333327
A79: 9020139A | B79: 9 | C79: 9 | D79: 13 | E79: 7 | F79: =(SUM(B79:E79)-SMALL(B79:E79,1))/3 -> 10.333333333333334 | G79: 10 | H79: 16 | I79: =(G79+H79)/4 -> 6.5 | J79: 42 | K79: 11 | L79: 65 | N79: 9 | O79: 63.433333333333337
A80: 9020140A | B80: 14 | C80: 12 | D80: 5 | E80: 7 | F80: =(SUM(B80:E80)-SMALL(B80:E80,1))/3 -> 11 | G80: 14 | H80: 15 | I80: =(G80+H80)/4 -> 7.25 | J80: 53 | K80: 13 | L80: 45 | M80: 1 | N80: 9 | O80: 63.15
F81: =AVERAGE(F2:F80) -> 12.831223628691991 | I81: =AVERAGE(I2:I80) -> 7.2436708860759493 | J81: =AVERAGE(J2:J80) -> 48.936708860759495 | K81: =AVERAGE(K2:K80) -> 12.338235294117647 | L81: =AVERAGE(L2:L80) -> 49.88607594936709 | O81: =AVERAGE(O2:O80) -> 63.111181434599118