B1: Q1 | C1: Q2 | D1: Q3 | E1: Q4 | G1: H1 | H1: H2 | J1: Midterm | K1: Report | L1: Final | N1: 平時 | O1: 學期成績
A2: 9020012M | B2: 14 | C2: 16 | D2: 10 | E2: 15 | F2: =(SUM(B2:E2)-SMALL(B2:E2,1))/3 -> 15 | G2: 10 | H2: 18 | I2: =(G2+H2)/4 -> 7 | J2: 49 | K2: 16 | L2: 50 | N2: 9 | O2: 68.7
A3: 9020019M | B3: 16 | C3: 17 | D3: 13 | E3: 17 | F3: =(SUM(B3:E3)-SMALL(B3:E3,1))/3 -> 16.666666666666668 | G3: 15 | H3: 20 | I3: =(G3+H3)/4 -> 8.75 | J3: 73 | K3: 18 | L3: 65 | M3: 1 | N3: 9 | O3: 84.816666666666663
A4: 8720016 | B4: 13 | C4: 16 | D4: 15 | E4: 19 | F4: =(SUM(B4:E4)-SMALL(B4:E4,1))/3 -> 16.666666666666668 | G4: 16 | H4: 16 | I4: =(G4+H4)/4 -> 8 | J4: 75 | K4: 16 | L4: 65 | N4: 9 | O4: 83.666666666666671
A5: 8720074 | B5: 16 | C5: 17 | D5: 17 | E5: 16 | F5: =(SUM(B5:E5)-SMALL(B5:E5,1))/3 -> 16.666666666666668 | G5: 18 | H5: 17 | I5: =(G5+H5)/4 -> 8.75 | J5: 85 | K5: 17 | L5: 77 | N5: 9 | O5: 91.516666666666666
A6: 8720122 | B6: 13 | C6: 18 | D6: 11 | E6: 10 | F6: =(SUM(B6:E6)-SMALL(B6:E6,1))/3 -> 14 | G6: 14 | H6: 20 | I6: =(G6+H6)/4 -> 8.5 | J6: 86 | K6: 14 | L6: 77 | N6: 9 | O6: 87.4
A7: 8720817 | B7: 9 | C7: 10 | D7: 10 | E7: 9 | F7: =(SUM(B7:E7)-SMALL(B7:E7,1))/3 -> 9.6666666666666661 | G7: 16 | H7: 20 | I7: =(G7+H7)/4 -> 9 | J7: 74 | K7: 15 | L7: 67 | M7: 1 | N7: 9 | O7: 77.466666666666654
A8: 8720827 | B8: 12 | C8: 11 | D8: 12 | E8: 10 | F8: =(SUM(B8:E8)-SMALL(B8:E8,1))/3 -> 11.666666666666666 | G8: 11 | H8: 20 | I8: =(G8+H8)/4 -> 7.75 | J8: 68 | K8: 13 | L8: 68 | M8: 1 | N8: 9 | O8: 75.716666666666669
A9: 8820123 | B9: 12 | C9: 17 | D9: 15 | E9: 11 | F9: =(SUM(B9:E9)-SMALL(B9:E9,1))/3 -> 14.666666666666666 | G9: 15 | H9: 20 | I9: =(G9+H9)/4 -> 8.75 | J9: 62 | K9: 15 | L9: 74 | M9: 1 | N9: 9 | O9: 80.716666666666669
A10: 8820125 | B10: 15 | C10: 16 | D10: 16 | E10: 14 | F10: =(SUM(B10:E10)-SMALL(B10:E10,1))/3 -> 15.666666666666666 | G10: 16 | H10: 20 | I10: =(G10+H10)/4 -> 9 | J10: 60 | K10: 15 | L10: 69 | N10: 9 | O10: 79.86666666666666
A11: 8820813 | B11: 12 | C11: 11 | D11: 11 | E11: 4 | F11: =(SUM(B11:E11)-SMALL(B11:E11,1))/3 -> 11.333333333333334 | G11: 15 | H11: 18 | I11: =(G11+H11)/4 -> 8.25 | J11: 64 | K11: 2 | L11: 43 | N11: 9 | O11: 61.68333333333333
A12: 9020002A | B12: 12 | C12: 11 | D12: 11 | E12: 10 | F12: =(SUM(B12:E12)-SMALL(B12:E12,1))/3 -> 11.333333333333334 | G12: 15 | H12: 14 | I12: =(G12+H12)/4 -> 7.25 | J12: 55 | K12: 15 | L12: 45 | M12: 2 | N12: 6 | O12: 62.083333333333336
A13: 9020010A | B13: 16 | C13: 6 | D13: 10 | E13: 12 | F13: =(SUM(B13:E13)-SMALL(B13:E13,1))/3 -> 12.666666666666666 | G13: 14 | H13: 14 | I13: =(G13+H13)/4 -> 7 | J13: 47 | K13: 14 | L13: 47 | N13: 9 | O13: 63.866666666666667
A14: 9020012A | B14: 12 | C14: 13 | D14: 11 | E14: 15 | F14: =(SUM(B14:E14)-SMALL(B14:E14,1))/3 -> 13.333333333333334 | G14: 8 | H14: 18 | I14: =(G14+H14)/4 -> 6.5 | J14: 67 | K14: 15 | L14: 64 | N14: 9 | O14: 75.63333333333334
A15: 9020014A | B15: 15 | C15: 14 | D15: 8 | E15: 13 | F15: =(SUM(B15:E15)-SMALL(B15:E15,1))/3 -> 14 | G15: 10 | H15: 18 | I15: =(G15+H15)/4 -> 7 | J15: 33 | K15: 13 | L15: 37 | N15: 9 | O15: 60
A16: 9020018A | B16: 15 | C16: 18 | D16: 15 | E16: 17 | F16: =(SUM(B16:E16)-SMALL(B16:E16,1))/3 -> 16.666666666666668 | G16: 14 | H16: 17 | I16: =(G16+H16)/4 -> 7.75 | J16: 50 | K16: 15 | L16: 73 | N16: 9 | O16: 77.816666666666663
A17: 9020020A | B17: 11 | C17: 17 | D17: 9 | E17: 8 | F17: =(SUM(B17:E17)-SMALL(B17:E17,1))/3 -> 12.333333333333334 | G17: 14 | H17: 19 | I17: =(G17+H17)/4 -> 8.25 | J17: 42 | K17: 8 | L17: 38 | N17: 9 | O17: 60
A18: 9020022A | B18: 13 | C18: 17 | D18: 15 | E18: 16 | F18: =(SUM(B18:E18)-SMALL(B18:E18,1))/3 -> 16 | G18: 13 | H18: 14 | I18: =(G18+H18)/4 -> 6.75 | J18: 64 | L18: 77 | M18: 2 | N18: 6 | O18: 71.05
A19: 9020024A | B19: 13 | C19: 8 | D19: 10 | E19: 9 | F19: =(SUM(B19:E19)-SMALL(B19:E19,1))/3 -> 10.666666666666666 | G19: 12 | H19: 18 | I19: =(G19+H19)/4 -> 7.5 | J19: 65 | K19: 12 | L19: 47 | N19: 9 | O19: 66.766666666666666
A20: 9020026A | B20: 12 | C20: 15 | D20: 10 | E20: 5 | F20: =(SUM(B20:E20)-SMALL(B20:E20,1))/3 -> 12.333333333333334 | G20: 14 | H20: 15 | I20: =(G20+H20)/4 -> 7.25 | J20: 40 | K20: 15 | L20: 27 | N20: 9 | O20: 56.183333333333337
A21: 9020028A | B21: 8 | C21: 12 | D21: 13 | E21: 13 | F21: =(SUM(B21:E21)-SMALL(B21:E21,1))/3 -> 12.666666666666666 | G21: 14 | H21: 16 | I21: =(G21+H21)/4 -> 7.5 | J21: 62 | K21: 15 | L21: 44 | M21: 1 | N21: 9 | O21: 68.466666666666669
A22: 9020030A | B22: 14 | C22: 14 | D22: 10 | E22: 12 | F22: =(SUM(B22:E22)-SMALL(B22:E22,1))/3 -> 13.333333333333334 | G22: 12 | H22: 16 | I22: =(G22+H22)/4 -> 7 | J22: 42 | K22: 15 | L22: 30 | N22: 9 | O22: 60
A23: 9020032A | B23: 9 | C23: 18 | D23: 14 | E23: 14 | F23: =(SUM(B23:E23)-SMALL(B23:E23,1))/3 -> 15.333333333333334 | G23: 11 | H23: 20 | I23: =(G23+H23)/4 -> 7.75 | J23: 46 | K23: 17 | L23: 59 | N23: 9 | O23: 72.083333333333329
A24: 9020034A | B24: 10 | C24: 13 | D24: 11 | E24: 12 | F24: =(SUM(B24:E24)-SMALL(B24:E24,1))/3 -> 12 | G24: 12 | H24: 19 | I24: =(G24+H24)/4 -> 7.75 | J24: 57 | K24: 12 | L24: 52 | N24: 9 | O24: 67.45
A25: 9020036A | B25: 10 | C25: 11 | D25: 7 | E25: 13 | F25: =(SUM(B25:E25)-SMALL(B25:E25,1))/3 -> 11.333333333333334 | G25: 15 | H25: 20 | I25: =(G25+H25)/4 -> 8.75 | J25: 62 | K25: 12 | L25: 45 | M25: 1 | N25: 9 | O25: 67.183333333333337
A26: 9020042A | B26: 14 | C26: 16 | D26: 10 | E26: 15 | F26: =(SUM(B26:E26)-SMALL(B26:E26,1))/3 -> 15 | G26: 15 | H26: 20 | I26: =(G26+H26)/4 -> 8.75 | J26: 70 | K26: 9 | L26: 52 | M26: 1 | N26: 9 | O26: 73.85
A27: 9020046A | B27: 13 | C27: 17 | D27: 9 | E27: 17 | F27: =(SUM(B27:E27)-SMALL(B27:E27,1))/3 -> 15.666666666666666 | G27: 16 | H27: 20 | I27: =(G27+H27)/4 -> 9 | J27: 47 | K27: 14 | L27: 53 | N27: 9 | O27: 70.666666666666657
A28: 9020048A | B28: 14 | C28: 16 | E28: 6 | F28: =SUM(B28:E28)/3 -> 12 | H28: 16 | I28: =(G28+H28)/4 -> 4 | J28: 50 | K28: 14 | L28: 39 | M28: 3 | N28: 3 | O28: 52.7
A29: 9020050A | B29: 15 | C29: 18 | D29: 18 | E29: 10 | F29: =(SUM(B29:E29)-SMALL(B29:E29,1))/3 -> 17 | G29: 18 | H29: 20 | I29: =(G29+H29)/4 -> 9.5 | J29: 63 | K29: 13 | L29: 65 | N29: 9 | O29: 80.4
A30: 9020052A | B30: 12 | C30: 10 | D30: 11 | E30: 18 | F30: =(SUM(B30:E30)-SMALL(B30:E30,1))/3 -> 13.666666666666666 | G30: 13 | H30: 13 | I30: =(G30+H30)/4 -> 6.5 | J30: 43 | K30: 6 | L30: 83 | N30: 9 | O30: 69.966666666666669
A31: 9020054A | B31: 11 | C31: 14 | D31: 10 | E31: 9 | F31: =(SUM(B31:E31)-SMALL(B31:E31,1))/3 -> 11.666666666666666 | G31: 10 | H31: 18 | I31: =(G31+H31)/4 -> 7 | J31: 61 | K31: 14 | L31: 36 | N31: 9 | O31: 63.766666666666666
A32: 9020058A | B32: 11 | C32: 19 | D32: 9 | E32: 9 | F32: =(SUM(B32:E32)-SMALL(B32:E32,1))/3 -> 13 | G32: 10 | H32: 13 | I32: =(G32+H32)/4 -> 5.75 | J32: 71 | K32: 13 | L32: 41 | N32: 9 | O32: 67.85
A33: 9020060A | B33: 11 | C33: 16 | D33: 4 | E33: 11 | F33: =(SUM(B33:E33)-SMALL(B33:E33,1))/3 -> 12.666666666666666 | G33: 11 | H33: 18 | I33: =(G33+H33)/4 -> 7.25 | J33: 37 | K33: 14 | L33: 35 | N33: 9 | O33: 60
A34: 9020062A | B34: 4 | C34: 18 | D34: 6 | E34: 15 | F34: =(SUM(B34:E34)-SMALL(B34:E34,1))/3 -> 13 | G34: 9 | H34: 20 | I34: =(G34+H34)/4 -> 7.25 | J34: 43 | K34: 13 | L34: 41 | M34: 1 | N34: 9 | O34: 60.95
A35: 9020064A | B35: 16 | C35: 16 | D35: 7 | E35: 12 | F35: =(SUM(B35:E35)-SMALL(B35:E35,1))/3 -> 14.666666666666666 | G35: 15 | H35: 18 | I35: =(G35+H35)/4 -> 8.25 | J35: 62 | K35: 13 | L35: 42 | M35: 1 | N35: 9 | O35: 69.616666666666674
A36: 9020066A | B36: 14 | C36: 17 | D36: 12 | E36: 15 | F36: =(SUM(B36:E36)-SMALL(B36:E36,1))/3 -> 15.333333333333334 | G36: 16 | H36: 14 | I36: =(G36+H36)/4 -> 7.5 | J36: 47 | K36: 15 | L36: 47 | N36: 9 | O36: 67.533333333333331
A37: 9020068A | B37: 14 | C37: 12 | D37: 11 | E37: 12 | F37: =(SUM(B37:E37)-SMALL(B37:E37,1))/3 -> 12.666666666666666 | G37: 12 | H37: 13 | I37: =(G37+H37)/4 -> 6.25 | J37: 58 | K37: 16 | L37: 60 | N37: 9 | O37: 71.316666666666663
A38: 9020070A | B38: 14 | C38: 18 | D38: 13 | E38: 13 | F38: =(SUM(B38:E38)-SMALL(B38:E38,1))/3 -> 15 | G38: 12 | H38: 20 | I38: =(G38+H38)/4 -> 8 | J38: 45 | K38: 12 | L38: 75 | N38: 9 | O38: 74
A39: 9020072A | B39: 8 | C39: 14 | D39: 1 | E39: 6 | F39: =(SUM(B39:E39)-SMALL(B39:E39,1))/3 -> 9.3333333333333339 | G39: 9 | H39: 15 | I39: =(G39+H39)/4 -> 6 | J39: 37 | K39: 10 | L39: 31 | N39: 9 | O39: 49.733333333333334
A40: 9020074A | B40: 11 | C40: 11 | D40: 7 | E40: 12 | F40: =(SUM(B40:E40)-SMALL(B40:E40,1))/3 -> 11.333333333333334 | G40: 9 | H40: 19 | I40: =(G40+H40)/4 -> 7 | J40: 38 | K40: 11 | L40: 40 | M40: 2 | N40: 6 | O40: 53.233333333333334
A41: 9020076A | B41: 13 | C41: 15 | D41: 6 | E41: 14 | F41: =(SUM(B41:E41)-SMALL(B41:E41,1))/3 -> 14 | G41: 18 | H41: 18 | I41: =(G41+H41)/4 -> 9 | J41: 44 | K41: 18 | L41: 29 | M41: 1 | N41: 9 | O41: 62.9
A42: 9020078A | B42: 10 | C42: 7 | D42: 12 | E42: 11 | F42: =(SUM(B42:E42)-SMALL(B42:E42,1))/3 -> 11 | G42: 11 | H42: 14 | I42: =(G42+H42)/4 -> 6.25 | J42: 46 | K42: 15 | L42: 52 | N42: 9 | O42: 63.15
A43: 9020080A | D43: 4 | E43: 11 | F43: =SUM(B43:E43)/3 -> 5 | I43: =(G43+H43)/4 -> 0 | J43: 47 | L43: 29 | M43: 5 | N43: 0 | O43: 27.8
A44: 9020082A | B44: 15 | C44: 14 | D44: 11 | E44: 14 | F44: =(SUM(B44:E44)-SMALL(B44:E44,1))/3 -> 14.333333333333334 | G44: 16 | I44: =(G44+H44)/4 -> 4 | J44: 62 | K44: 11 | L44: 48 | N44: 9 | O44: 65.833333333333343
A45: 9020084A | B45: 12 | C45: 12 | D45: 10 | E45: 11 | F45: =(SUM(B45:E45)-SMALL(B45:E45,1))/3 -> 11.666666666666666 | G45: 8 | H45: 18 | I45: =(G45+H45)/4 -> 6.5 | J45: 28 | K45: 14 | L45: 32 | N45: 9 | O45: 52.166666666666664
A46: 9020086A | B46: 10 | C46: 14 | D46: 8 | E46: 6 | F46: =(SUM(B46:E46)-SMALL(B46:E46,1))/3 -> 10.666666666666666 | G46: 14 | H46: 16 | I46: =(G46+H46)/4 -> 7.5 | J46: 45 | K46: 13 | L46: 27 | N46: 9 | O46: 55.266666666666666
A47: 9020088A | B47: 10 | C47: 11 | D47: 15 | E47: 18 | F47: =(SUM(B47:E47)-SMALL(B47:E47,1))/3 -> 14.666666666666666 | G47: 11 | H47: 14 | I47: =(G47+H47)/4 -> 6.25 | J47: 60 | K47: 15 | L47: 68 | N47: 9 | O47: 75.816666666666663
A48: 9020090A | B48: 7 | C48: 8 | D48: 4 | E48: 3 | F48: =(SUM(B48:E48)-SMALL(B48:E48,1))/3 -> 6.333333333333333 | G48: 13 | H48: 20 | I48: =(G48+H48)/4 -> 8.25 | J48: 33 | K48: 14 | L48: 18 | N48: 9 | O48: 45.883333333333333
A49: 9020092A | B49: 16 | C49: 15 | D49: 10 | E49: 16 | F49: =(SUM(B49:E49)-SMALL(B49:E49,1))/3 -> 15.666666666666666 | G49: 15 | H49: 15 | I49: =(G49+H49)/4 -> 7.5 | J49: 58 | K49: 14 | L49: 60 | N49: 9 | O49: 74.566666666666663
A50: 9020094A | B50: 8 | C50: 12 | D50: 17 | E50: 15 | F50: =(SUM(B50:E50)-SMALL(B50:E50,1))/3 -> 14.666666666666666 | G50: 11 | H50: 20 | I50: =(G50+H50)/4 -> 7.75 | J50: 37 | K50: 11 | L50: 49 | N50: 9 | O50: 62.716666666666669
A51: 9020096A | B51: 9 | C51: 6 | D51: 17 | E51: 16 | F51: =(SUM(B51:E51)-SMALL(B51:E51,1))/3 -> 14 | G51: 13 | H51: 20 | I51: =(G51+H51)/4 -> 8.25 | J51: 47 | K51: 16 | L51: 60 | N51: 9 | O51: 71.35
A52: 9020098A | B52: 9 | C52: 8 | D52: 6 | E52: 9 | F52: =(SUM(B52:E52)-SMALL(B52:E52,1))/3 -> 8.6666666666666661 | G52: 13 | H52: 20 | I52: =(G52+H52)/4 -> 8.25 | J52: 48 | L52: 50 | M52: 2 | N52: 6 | O52: 52.316666666666663
A53: 9020100A | B53: 15 | C53: 15 | D53: 8 | E53: 7 | F53: =(SUM(B53:E53)-SMALL(B53:E53,1))/3 -> 12.666666666666666 | G53: 17 | H53: 20 | I53: =(G53+H53)/4 -> 9.25 | J53: 55 | K53: 15 | L53: 32 | N53: 9 | O53: 64.516666666666666
A54: 9020104A | B54: 9 | C54: 17 | D54: 15 | E54: 11 | F54: =(SUM(B54:E54)-SMALL(B54:E54,1))/3 -> 14.333333333333334 | G54: 13 | H54: 19 | I54: =(G54+H54)/4 -> 8 | J54: 50 | K54: 13 | L54: 52 | N54: 9 | O54: 68.433333333333337
A55: 9020106A | B55: 13 | C55: 9 | D55: 8 | E55: 14 | F55: =(SUM(B55:E55)-SMALL(B55:E55,1))/3 -> 12 | G55: 13 | H55: 20 | I55: =(G55+H55)/4 -> 8.25 | J55: 45 | L55: 31 | M55: 2 | N55: 6 | O55: 49.05
A56: 9020108A | B56: 19 | C56: 16 | D56: 14 | E56: 16 | F56: =(SUM(B56:E56)-SMALL(B56:E56,1))/3 -> 17 | G56: 15 | H56: 17 | I56: =(G56+H56)/4 -> 8 | J56: 63 | K56: 16 | L56: 51 | N56: 9 | O56: 76.2
A57: 9020110A | B57: 15 | C57: 11 | D57: 16 | E57: 14 | F57: =(SUM(B57:E57)-SMALL(B57:E57,1))/3 -> 15 | G57: 17 | H57: 15 | I57: =(G57+H57)/4 -> 8 | J57: 60 | K57: 11 | L57: 76 | N57: 9 | O57: 78.3
A58: 9020112A | B58: 8 | C58: 15 | D58: 3 | E58: 6 | F58: =(SUM(B58:E58)-SMALL(B58:E58,1))/3 -> 9.6666666666666661 | G58: 12 | H58: 17 | I58: =(G58+H58)/4 -> 7.25 | J58: 38 | K58: 2 | L58: 46 | M58: 2 | N58: 6 | O58: 49.11666666666666
A59: 9020114A | B59: 10 | C59: 9 | D59: 3 | E59: 14 | F59: =(SUM(B59:E59)-SMALL(B59:E59,1))/3 -> 11 | G59: 12 | H59: 20 | I59: =(G59+H59)/4 -> 8 | J59: 34 | K59: 13 | L59: 28 | N59: 9 | O59: 53.1
A60: 9020116A | B60: 7 | D60: 6 | E60: 5 | F60: =SUM(B60:E60)/3 -> 6 | G60: 11 | I60: =(G60+H60)/4 -> 2.75 | J60: 24 | L60: 24 | M60: 6 | N60: 0 | O60: 23.15
A61: 9020118A | B61: 9 | C61: 7 | D61: 8 | E61: 7 | F61: =(SUM(B61:E61)-SMALL(B61:E61,1))/3 -> 8 | G61: 8 | H61: 15 | I61: =(G61+H61)/4 -> 5.75 | J61: 36 | L61: 33 | M61: 2 | N61: 6 | O61: 40.45
A62: 9020120A | B62: 10 | C62: 17 | D62: 8 | E62: 13 | F62: =(SUM(B62:E62)-SMALL(B62:E62,1))/3 -> 13.333333333333334 | G62: 14 | H62: 18 | I62: =(G62+H62)/4 -> 8 | J62: 51 | K62: 11 | L62: 40 | N62: 9 | O62: 63.133333333333333
A63: 9020122A | B63: 8 | C63: 7 | D63: 6 | E63: 4 | F63: =(SUM(B63:E63)-SMALL(B63:E63,1))/3 -> 7 | G63: 10 | H63: 14 | I63: =(G63+H63)/4 -> 6 | J63: 42 | L63: 36 | M63: 3 | N63: 3 | O63: 39.4
A64: 9020124A | B64: 14 | C64: 12 | D64: 4 | E64: 6 | F64: =(SUM(B64:E64)-SMALL(B64:E64,1))/3 -> 10.666666666666666 | G64: 13 | H64: 17 | I64: =(G64+H64)/4 -> 7.5 | J64: 45 | K64: 4 | L64: 27 | M64: 2 | N64: 6 | O64: 47.766666666666666
A65: 9020126A | B65: 13 | C65: 14 | D65: 5 | E65: 10 | F65: =(SUM(B65:E65)-SMALL(B65:E65,1))/3 -> 12.333333333333334 | G65: 14 | H65: 17 | I65: =(G65+H65)/4 -> 7.75 | J65: 38 | K65: 15 | L65: 39 | N65: 9 | O65: 59.683333333333337
A66: 9020128A | B66: 8 | C66: 14 | D66: 7 | E66: 11 | F66: =(SUM(B66:E66)-SMALL(B66:E66,1))/3 -> 11 | G66: 12 | H66: 16 | I66: =(G66+H66)/4 -> 7 | J66: 60 | K66: 14 | L66: 46 | N66: 9 | O66: 65.8
A67: 9020130A | B67: 8 | C67: 6 | D67: 4 | E67: 4 | F67: =(SUM(B67:E67)-SMALL(B67:E67,1))/3 -> 6 | G67: 9 | H67: 19 | I67: =(G67+H67)/4 -> 7 | J67: 33 | K67: 16 | L67: 45 | N67: 9 | O67: 53.4
A68: 9020132A | B68: 11 | C68: 13 | D68: 10 | E68: 9 | F68: =(SUM(B68:E68)-SMALL(B68:E68,1))/3 -> 11.333333333333334 | G68: 14 | H68: 20 | I68: =(G68+H68)/4 -> 8.5 | J68: 51 | K68: 14 | L68: 50 | N68: 9 | O68: 66.133333333333326
A69: 9020134A | B69: 15 | C69: 8 | D69: 9 | E69: 7 | F69: =(SUM(B69:E69)-SMALL(B69:E69,1))/3 -> 10.666666666666666 | G69: 14 | H69: 19 | I69: =(G69+H69)/4 -> 8.25 | J69: 48 | K69: 2 | L69: 31 | N69: 9 | O69: 52.61666666666666
A70: 9020136A | B70: 5 | C70: 14 | D70: 8 | E70: 2 | F70: =(SUM(B70:E70)-SMALL(B70:E70,1))/3 -> 9 | G70: 9 | H70: 14 | I70: =(G70+H70)/4 -> 5.75 | J70: 32 | K70: 9 | L70: 26 | M70: 2 | N70: 6 | O70: 42.65
A71: 9020138A | B71: 10 | C71: 4 | D71: 17 | E71: 13 | F71: =(SUM(B71:E71)-SMALL(B71:E71,1))/3 -> 13.333333333333334 | G71: 13 | H71: 17 | I71: =(G71+H71)/4 -> 7.5 | J71: 65 | K71: 18 | L71: 56 | N71: 9 | O71: 75.13333333333334
F72: =AVERAGE(F2:F71) -> 12.557142857142857 | I72: =AVERAGE(I2:I71) -> 7.3392857142857144 | J72: =AVERAGE(J2:J71) -> 51.785714285714285 | K72: =AVERAGE(K2:K71) -> 13.015873015873016 | L72: =AVERAGE(L2:L71) -> 48.157142857142858 | O72: =AVERAGE(O2:O71) -> 64.050238095238086