C1: 指數平滑法是以最近一期的預測數為基準，每一預測值是以上一期預測值與實際需求值為基礎計算出來的。
C3: 基本公式：預測值=上期預測值+α(上期實際需求-上期預測值)
C4: α=平滑係數(可以隨時改變)
C6: 1. 利用公式將預測值算出(α先設定為0.4)
C7: α= | D7: 00.4
A8: 0 | C8: Day | D8: 1 | E8: 2 | F8: 3 | G8: 4 | H8: 5 | I8: 6 | J8: 7 | K8: 8 | L8: 9 | M8: 10
A9: A0= | B9: 245 | C9: 銷售量 | D9: 275 | E9: 290 | F9: 335 | G9: 310 | H9: 360 | I9: 400 | J9: 450 | K9: 390 | L9: 420 | M9: 490
A10: F0= | B10: 260 | D10: =B10+$D$7*(B9-B10) -> 254 | E10: =D10+$D$7*(D9-D10) -> 262.4 | F10: =E10+$D$7*(E9-E10) -> 273.44 | H10: =G10+$D$7*(G9-G10) -> 302.83840000000004 | I10: =H10+$D$7*(H9-H10) -> 325.70304000000004 | J10: =I10+$D$7*(I9-I10) -> 355.42182400000002 | K10: =J10+$D$7*(J9-J10) -> 393.25309440000001 | L10: =K10+$D$7*(K9-K10) -> 391.95185664000002 | M10: =L10+$D$7*(L9-L10) -> 403.17111398399999
C15: 2. 評估此方法的預測值是否可採用
D16: =D9-D10 -> 21 | E16: =E9-E10 -> 27.6 | F16: =F9-F10 -> 61.56 | G16: =G9-G10 -> 11.935999999999979 | H16: =H9-H10 -> 57.161599999999964 | I16: =I9-I10 -> 74.296959999999956 | J16: =J9-J10 -> 94.578175999999985 | K16: =K9-K10 -> -3.253094400000009 | L16: =L9-L10 -> 28.048143359999983 | M16: =M9-M10 -> 86.828886016000013
C17: Abs. Error | D17: =ABS(D16) -> 21 | E17: =ABS(E16) -> 27.6 | F17: =ABS(F16) -> 61.56 | G17: =ABS(G16) -> 11.935999999999979 | H17: =ABS(H16) -> 57.161599999999964 | I17: =ABS(I16) -> 74.296959999999956 | J17: =ABS(J16) -> 94.578175999999985 | K17: =ABS(K16) -> 3.253094400000009 | L17: =ABS(L16) -> 28.048143359999983 | M17: =ABS(M16) -> 86.828886016000013
C18: RSFE | D18: =SUM($D16:D16) -> 21 | E18: =SUM($D16:E16) -> 48.6 | F18: =SUM($D16:F16) -> 110.16 | G18: =SUM($D16:G16) -> 122.096 | H18: =SUM($D16:H16) -> 179.25759999999997 | I18: =SUM($D16:I16) -> 253.55455999999992 | J18: =SUM($D16:J16) -> 348.13273599999991 | K18: =SUM($D16:K16) -> 344.8796415999999 | L18: =SUM($D16:L16) -> 372.92778495999988 | M18: =SUM($D16:M16) -> 459.7566709759999
C19: MAD | D19: =AVERAGE($D17:D17) -> 21 | E19: =AVERAGE($D17:E17) -> 24.3 | F19: =AVERAGE($D17:F17) -> 36.720 | G19: =AVERAGE($D17:G17) -> 30.524000000000001 | H19: =AVERAGE($D17:H17) -> 35.851519999999994 | I19: =AVERAGE($D17:I17) -> 42.259093333333318 | J19: =AVERAGE($D17:J17) -> 49.733247999999989 | K19: =AVERAGE($D17:K17) -> 43.92322879999999 | L19: =AVERAGE($D17:L17) -> 42.159330417777767 | M19: =AVERAGE($D17:M17) -> 46.626285977599991
C20: TS | D20: =D18/D19 -> 1 | E20: =E18/E19 -> 2 | F20: =F18/F19 -> 3 | G20: =G18/G19 -> 4 | H20: =H18/H19 -> 5 | I20: =I18/I19 -> 6 | J20: =J18/J19 -> 7 | K20: =K18/K19 -> 7.8518736218226284 | L20: =L18/L19 -> 8.8456761828158328 | M20: =M18/M19 -> 9.8604609253431494
C25: 3. 再計算α=0.25的預測值與評估此方法
C26: α= | D26: 0.25
C27: Forecast | D27: =B10+$D$26*(B9-B10) -> 256.25 | E27: =D27+$D$26*(D9-D27) -> 260.9375 | F27: =E27+$D$26*(E9-E27) -> 268.203125 | G27: =F27+$D$26*(F9-F27) -> 284.90234375 | H27: =G27+$D$26*(G9-G27) -> 291.1767578125 | I27: =H27+$D$26*(H9-H27) -> 308.382568359375 | J27: =I27+$D$26*(I9-I27) -> 331.28692626953125 | K27: =J27+$D$26*(J9-J27) -> 360.96519470214844 | L27: =K27+$D$26*(K9-K27) -> 368.22389602661133 | M27: =L27+$D$26*(L9-L27) -> 381.1679220199585
C28: Error | D28: =D9-D27 -> 18.75 | E28: =E9-E27 -> 29.0625 | F28: =F9-F27 -> 66.796875 | G28: =G9-G27 -> 25.09765625 | H28: =H9-H27 -> 68.8232421875 | I28: =I9-I27 -> 91.617431640625 | J28: =J9-J27 -> 118.71307373046875 | K28: =K9-K27 -> 29.034805297851563 | L28: =L9-L27 -> 51.776103973388672 | M28: =M9-M27 -> 108.8320779800415
C29: Abs. Error | D29: =ABS(D28) -> 18.75 | E29: =ABS(E28) -> 29.0625 | F29: =ABS(F28) -> 66.796875 | G29: =ABS(G28) -> 25.09765625 | H29: =ABS(H28) -> 68.8232421875 | I29: =ABS(I28) -> 91.617431640625 | J29: =ABS(J28) -> 118.71307373046875 | K29: =ABS(K28) -> 29.034805297851563 | L29: =ABS(L28) -> 51.776103973388672 | M29: =ABS(M28) -> 108.8320779800415
C30: RSFE | D30: =SUM($D28:D28) -> 18.75 | E30: =SUM($D28:E28) -> 47.8125 | F30: =SUM($D28:F28) -> 114.609375 | G30: =SUM($D28:G28) -> 139.70703125 | H30: =SUM($D28:H28) -> 208.5302734375 | I30: =SUM($D28:I28) -> 300.147705078125 | J30: =SUM($D28:J28) -> 418.86077880859375 | K30: =SUM($D28:K28) -> 447.89558410644531 | L30: =SUM($D28:L28) -> 499.67168807983398 | M30: =SUM($D28:M28) -> 608.50376605987549
C31: MAD | D31: =AVERAGE($D29:D29) -> 18.75 | E31: =AVERAGE($D29:E29) -> 23.90625 | F31: =AVERAGE($D29:F29) -> 38.203125 | G31: =AVERAGE($D29:G29) -> 34.9267578125 | H31: =AVERAGE($D29:H29) -> 41.7060546875 | I31: =AVERAGE($D29:I29) -> 50.024617513020836 | J31: =AVERAGE($D29:J29) -> 59.837254115513396 | K31: =AVERAGE($D29:K29) -> 55.986948013305664 | L31: =AVERAGE($D29:L29) -> 55.519076453314888 | M31: =AVERAGE($D29:M29) -> 60.850376605987549
C32: TS | D32: =D30/D31 -> 1 | E32: =E30/E31 -> 2 | F32: =F30/F31 -> 3 | G32: =G30/G31 -> 4 | H32: =H30/H31 -> 5 | I32: =I30/I31 -> 6 | J32: =J30/J31 -> 7 | K32: =K30/K31 -> 8 | L32: =L30/L31 -> 9 | M32: =M30/M31 -> 10
C34: 4. 最後再畫圖比較哪個α值較適用

A1: Forecast

A1: =F10+$D$7*(F9-F10) -> 298.06400000000002

A1: Error