B1: 移動平均是使用一群最近的真實資料加以平均來進行預測。
B2: 移動平均的基本公式：MAN=(最近N期資料總和)/N
B3: 舉例來說，MA3就是以最近3期銷售量的平均值為預測值。
B4: 使用移動平均法會以 3天、5天、6天為基礎來求預測值，再評估何種最適合。
B6: 1. 利用公式將以3-period的預測值算出
B7: Day | C7: 1 | D7: 2 | E7: 3 | F7: 4 | G7: 5 | H7: 6 | I7: 7 | J7: 8 | K7: 9 | L7: 10
B8: 銷售量 | C8: 275 | D8: 290 | E8: 335 | F8: 310 | G8: 360 | H8: 400 | I8: 450 | J8: 390 | K8: 420 | L8: 490
B9: 3 day | F9: =AVERAGE(C8:E8) -> 300 | G9: =AVERAGE(D8:F8) -> 311.66666666666669 | H9: =AVERAGE(E8:G8) -> 335 | I9: =AVERAGE(F8:H8) -> 356.66666666666669 | J9: =AVERAGE(G8:I8) -> 403.33333333333331 | K9: =AVERAGE(H8:J8) -> 413.33333333333331 | L9: =AVERAGE(I8:K8) -> 420
B13: 2. 再利用之前提過的公式來看預測值是否可採信
B14: Error | F14: =F8-F9 -> 10 | G14: =G8-G9 -> 48.333333333333314 | H14: =H8-H9 -> 65 | I14: =I8-I9 -> 93.333333333333314 | J14: =J8-J9 -> -13.333333333333314 | K14: =K8-K9 -> 6.6666666666666856 | L14: =L8-L9 -> 70
B15: Abs. Error | F15: =ABS(F14) -> 10 | G15: =ABS(G14) -> 48.333333333333314 | H15: =ABS(H14) -> 65 | I15: =ABS(I14) -> 93.333333333333314 | J15: =ABS(J14) -> 13.333333333333314 | K15: =ABS(K14) -> 6.6666666666666856 | L15: =ABS(L14) -> 70
B16: RSFE | F16: =SUM($C14:F14) -> 10 | G16: =SUM($C14:G14) -> 58.333333333333314 | H16: =SUM($C14:H14) -> 123.33333333333331 | I16: =SUM($C14:I14) -> 216.66666666666663 | J16: =SUM($C14:J14) -> 203.33333333333331 | K16: =SUM($C14:K14) -> 210 | L16: =SUM($C14:L14) -> 280
B17: MAD | F17: =AVERAGE($C15:F15) -> 10 | G17: =AVERAGE($C15:G15) -> 29.166666666666657 | H17: =AVERAGE($C15:H15) -> 41.111111111111107 | I17: =AVERAGE($C15:I15) -> 54.166666666666657 | J17: =AVERAGE($C15:J15) -> 46 | K17: =AVERAGE($C15:K15) -> 39.444444444444436 | L17: =AVERAGE($C15:L15) -> 43.809523809523803
B18: TS | F18: =F16/F17 -> 1 | G18: =G16/G17 -> 2 | H18: =H16/H17 -> 3 | I18: =I16/I17 -> 4 | J18: =J16/J17 -> 4.4202898550724647 | K18: =K16/K17 -> 5.3239436619718319 | L18: =L16/L17 -> 6.3913043478260878
B24: 3. 求以5-period為基礎的預測值與Error、RSFE、MAD、TS，算法與3-period相同
B25: 5 day | H25: =AVERAGE(C8:G8) -> 314 | I25: =AVERAGE(D8:H8) -> 339 | J25: =AVERAGE(E8:I8) -> 371 | K25: =AVERAGE(F8:J8) -> 382 | L25: =AVERAGE(G8:K8) -> 404
B26: Error | H26: =H8-H25 -> 86 | I26: =I8-I25 -> 111 | J26: =J8-J25 -> 19 | K26: =K8-K25 -> 38 | L26: =L8-L25 -> 86
B27: Abs. Error | H27: =ABS(H26) -> 86 | I27: =ABS(I26) -> 111 | J27: =ABS(J26) -> 19 | K27: =ABS(K26) -> 38 | L27: =ABS(L26) -> 86
B28: RSFE | H28: =SUM($C26:H26) -> 86 | I28: =SUM($C26:I26) -> 197 | J28: =SUM($C26:J26) -> 216 | K28: =SUM($C26:K26) -> 254 | L28: =SUM($C26:L26) -> 340
B29: MAD | H29: =AVERAGE($C27:H27) -> 86 | I29: =AVERAGE($C27:I27) -> 98.5 | J29: =AVERAGE($C27:J27) -> 72 | K29: =AVERAGE($C27:K27) -> 63.5 | L29: =AVERAGE($C27:L27) -> 68
B30: TS | H30: =H28/H29 -> 1 | I30: =I28/I29 -> 2 | J30: =J28/J29 -> 3 | K30: =K28/K29 -> 4 | L30: =L28/L29 -> 5
B32: 4. 最後可以畫圖表來看哪種方法誤差較少