B1: 迴歸模式是表示兩個變數之間的線性關係。目標是獲得直線方程式，該直線方程式使所有預測點與實際值的偏差平方何最小。
B3: 迴歸模式的基本公式 F=a+bX
B4: b=[n(ΣXY)-(ΣX)(ΣY)]/[n(ΣX2)-(ΣX)2] 和 a=(ΣY-bΣX)/n
B6: 1. 利用公式將預測值求出，然後再將評估的數值算出
B7: 必須先求出 a、b值
B9: Day | C9: 銷售量 | D9: Forecast | E9: Error | F9: Abs. Error | G9: RSFE | H9: MAD | I9: TS
B10: 1 | C10: 275 | D10: =C$21+B10*C$22 -> 274.36363636363637 | E10: =C10-D10 -> 0.63636363636362603 | F10: =ABS(E10) -> 0.63636363636362603 | G10: =SUM(E$10:E10) -> 0.63636363636362603 | H10: =SUM(F$10:F10) -> 0.63636363636362603 | I10: =G10/H10 -> 1
B11: 2 | C11: 290 | D11: =C$21+B11*C$22 -> 296.06060606060606 | E11: =C11-D11 -> -6.0606060606060623 | F11: =ABS(E11) -> 6.0606060606060623 | G11: =SUM(E$10:E11) -> -5.4242424242424363 | H11: =SUM(F$10:F11) -> 6.6969696969696884 | I11: =G11/H11 -> -0.80995475113122462
B12: 3 | C12: 335 | D12: =C$21+B12*C$22 -> 317.75757575757575 | E12: =C12-D12 -> 17.242424242424249 | F12: =ABS(E12) -> 17.242424242424249 | G12: =SUM(E$10:E12) -> 11.818181818181813 | H12: =SUM(F$10:F12) -> 23.939393939393938 | I12: =G12/H12 -> 0.49367088607594917
B13: 4 | C13: 310 | D13: =C$21+B13*C$22 -> 339.4545454545455 | E13: =C13-D13 -> -29.454545454545496 | F13: =ABS(E13) -> 29.454545454545496 | G13: =SUM(E$10:E13) -> -17.636363636363683 | H13: =SUM(F$10:F13) -> 53.393939393939434 | I13: =G13/H13 -> -0.33030646992054546
B14: 5 | C14: 360 | D14: =C$21+B14*C$22 -> 361.15151515151513 | E14: =C14-D14 -> -1.1515151515151274 | F14: =ABS(E14) -> 1.1515151515151274 | G14: =SUM(E$10:E14) -> -18.78787878787881 | H14: =SUM(F$10:F14) -> 54.545454545454561 | I14: =G14/H14 -> -0.34444444444444478
B15: 6 | C15: 400 | D15: =C$21+B15*C$22 -> 382.84848484848487 | E15: =C15-D15 -> 17.151515151515127 | F15: =ABS(E15) -> 17.151515151515127 | G15: =SUM(E$10:E15) -> -1.6363636363636829 | H15: =SUM(F$10:F15) -> 71.696969696969688 | I15: =G15/H15 -> -2.2823330515638861E-2
B16: 7 | C16: 450 | D16: =C$21+B16*C$22 -> 404.54545454545456 | E16: =C16-D16 -> 45.454545454545439 | F16: =ABS(E16) -> 45.454545454545439 | G16: =SUM(E$10:E16) -> 43.818181818181756 | H16: =SUM(F$10:F16) -> 117.15151515151513 | I16: =G16/H16 -> 0.37403000517330531
B17: 8 | C17: 390 | D17: =C$21+B17*C$22 -> 426.24242424242425 | E17: =C17-D17 -> -36.242424242424249 | F17: =ABS(E17) -> 36.242424242424249 | G17: =SUM(E$10:E17) -> 7.5757575757575069 | H17: =SUM(F$10:F17) -> 153.39393939393938 | I17: =G17/H17 -> 4.9387593836427844E-2
B18: 9 | C18: 420 | D18: =C$21+B18*C$22 -> 447.93939393939394 | E18: =C18-D18 -> -27.939393939393938 | F18: =ABS(E18) -> 27.939393939393938 | G18: =SUM(E$10:E18) -> -20.363636363636431 | H18: =SUM(F$10:F18) -> 181.33333333333331 | I18: =G18/H18 -> -0.11229946524064209
B19: 10 | C19: 490 | D19: =C$21+B19*C$22 -> 469.63636363636363 | E19: =C19-D19 -> 20.363636363636374 | F19: =ABS(E19) -> 20.363636363636374 | G19: =SUM(E$10:E19) -> -5.6843418860808015E-14 | H19: =SUM(F$10:F19) -> 201.69696969696969 | I19: =G19/H19 -> -2.8182584471253977E-16
B21: a= | C21: =AVERAGE(C10:C20)-C22*AVERAGE(B10:B20) -> 252.66666666666669
B22: b= | C22: =(SUMPRODUCT(B10:B19,C10:C19)-10*AVERAGE(B10:B19)*AVERAGE(C10:C19))/(SUMPRODUCT(B10:B19,B10:B19)-10*AVERAGE(B10,B19)^2) -> 21.696969696969695